3학년 4반 1번 고현준

1. 데이터베이스에 대한 설명으로 틀린 것을 고르시오 답안 (3)

2. 빅데이터

3-1. 기본키
3-2. 외래키

4-1. CREATE
4-2. PRIMARY KEY
4-3. FOREIGN KEY REGERENCES 학과(학과번호)

5. INSERT INTO 학생 VALUES(20200001, '홍영란', 1, NULL, 20, '서울시 용산구', 1);

6. (2,3,6,7)

7. (7개), (5개)

8. 복합키

9-1. 
select 이름, 사무실위치 
FROM 학과
where 사무실위치 LIKE '3호관%';

이름                                                 사무실위치                                                                                               
-------------------------------------------------- ----------------------------------------------------------------------------------------------------
컴퓨터소프트웨어공학과                             3호관 208호                                                                                         
컴퓨터정보공학과                                   3호관 209호                                                                                         

9-2.
SELECT * 
FROM 수강
WHERE 과목번호 = 'CS-100' and 학점 >= 4.0
order by 학점 DESC;

      학생번호 과목번호               학점
---------- ---------- ----------
   2017002 CS-100            4.5
   2016001 CS-100              4
   
9-3. 
SELECT A.과목번호, A.이름
FROM 교과목 A, 교수 B
WHERE A.교수번호=B.교수번호 AND B.이름 = '박대구';

과목번호       이름                                                                                                  
---------- ----------------------------------------------------------------------------------------------------
CS-101     컴퓨터제어실습                                                                                      
CS-102     웹 프로그래밍    

9-4.
SELECT 학생.이름 AS 학생이름, 
        학생.나이,
        학과.이름 AS 학과명
FROM 학생 LEFT OUTER JOIN 학과
        ON 학생.학과번호=학과.학과번호
WHERE 학생.나이 <= 20;

학생이름                                   나이 학과명                                               
------------------------------ ---------- --------------------------------------------------
김동양                                 20 컴퓨터소프트웨어공학과                            
윤재수                                 19             

10. 서울시 구로구에 살고 있는 학생의 학생번호, 이름, 학년, 주소를 출력하는 SQL 문을 작성하시오.

select 학생번호, 이름, 학년, 주소
from 학생
where 주소='서울시 구로구';

      학생번호 이름                                     학년 주소                                                                                                  
---------- ------------------------------ ---------- ----------------------------------------------------------------------------------------------------
   2017001 김동양                                  1 서울시 구로구   


11. 연봉이 5000만원 이상이고 재직년수가 10년 이하인 교수의 이름, 직위, 임용년도, 재직년수를 출력하는 SQL문을 작성하시오.

select 이름, 직위, 임영년도, (2020-임영년도) as 재직년수
from 교수
where 연봉 >= 5000 AND (2020-임영년도) <= 10;

이름                             직위                                   임영년도       재직년수
------------------------------ ------------------------------ ---------- ----------
박대구                         부교수                               2010         10

12. 김서울 교수가 담당하는 과목의 과목이름을 교수의 이름과 함께 출력하는 SQL문을 작성하시오
(오타)

select 교과목.이름, 교수.이름
from 교과목, 교수
where 교과목.교수번호 = 교수.교수번호 AND 교수.이름='김서율';

이름                                                                                                   이름                            
---------------------------------------------------------------------------------------------------- ------------------------------
데이터베이스관리                                                                                     김서율                   

13. '데이터베이스관리' 과목을 들은 학생들의 학생번호와 학생의 이름 그리고 학점을 학점순으로 내림차순으로 정렬하여 SQL문을 작성하시오.

SELECT 학생.학생번호, 학생.이름, 수강.학점
FROM 수강, 교과목, 학생
WHERE (수강.학생번호=학생.학생번호 and 수강.과목번호=교과목.과목번호 AND 교과목.이름='데이터베이스관리')
ORDER BY (수강.학점) DESC;

      학생번호 이름                                     학점
---------- ------------------------------ ----------
   2017002 이미래                                4.5
   2016001 박대학                                  4
   2017001 김동양                                3.5
   2017003 송고척                                1.5


14. 김동양 학생이 들은 과목 중에 박대구 교수가 강의하는 과목들의 학점을 학생의 이름, 과목의 이름, 교수 이름과 함께 출력하는 SQL문을 작성하시오

select 수강.학점, 학생.이름, 교과목.이름
from 수강, 학생, 교과목, 교수
where (수강.학생번호=학생.학생번호 AND 수강.과목번호=교과목.과목번호 AND 학생.이름='김동양' AND 교과목.교수번호=교수.교수번호 AND 교수.이름='박대구');

        학점 이름                             이름                                                                                                  
---------- ------------------------------ ----------------------------------------------------------------------------------------------------
       2.5 김동양                         컴퓨터제어실습                                                                                      
         3 김동양                         웹 프로그래밍      

15. "최부산" 교수의 연봉은 9000만원으로 인상하는 SQL문을 작성하시오.

update 교수 
set 연봉=9000 
where 이름='최부산';

select * from 교수;

      교수번호 이름                             직위                                   임영년도         나이         연봉       학과번호
---------- ------------------------------ ------------------------------ ---------- ---------- ---------- ----------
       100 김서율                         조교수                               2017         38       4000          4
       101 박대구                         부교수                               2010         45       6500          3
       102 최부산                         교수                                 1999         53       9000          1
       103 윤대전                         부교수                               2008         48       5700          2
       104 김광주                         조교수                               2014         31       4700          1

